{
  "schemaVersion": "1.0.0",
  "context": {
    "user": {
      "id": "7a1d4e22-0003-4f00-9a00-100000000003",
      "email": "deny.test@logistics-corp.example",
      "username": "deny.test",
      "displayName": "Deny Test User",
      "status": "ACTIVE"
    },
    "tenant": {
      "id": "11111111-1111-4111-8111-111111111111",
      "code": "LOGISTICS_CORE",
      "name": "Logistics Corp",
      "status": "ACTIVE"
    },
    "systemSuite": {
      "id": "22222222-2222-4222-8222-222222222222",
      "code": "WMS_SUITE",
      "name": "Warehouse Management Suite",
      "status": "PUBLISHED"
    },
    "role": {
      "id": "33333333-3333-4333-8333-333333333333",
      "code": "WAREHOUSE_SUPERVISOR",
      "name": "Warehouse Supervisor",
      "hierarchyLevel": 3,
      "parentRoleId": null
    },
    "profile": {
      "id": "44444444-4444-4444-8444-444444444446",
      "scope": "OrgWide",
      "isActive": true
    },
    "branch": null
  },
  "authentication": {
    "method": "Local",
    "provider": null,
    "mfaRequired": false,
    "issuedAt": "2026-05-31T14:30:00Z",
    "sessionExpiresAt": "2026-05-31T15:30:00Z"
  },
  "actions": [
    { "id": "a0000001-0000-4000-8000-000000000004", "code": "DELETE", "name": "Delete" }
  ],
  "menuAccess": [
    {
      "module": {
        "id": "50000001-0000-4000-8000-000000000001",
        "code": "INVENTORY",
        "name": "Inventory",
        "sortOrder": 1,
        "status": "PUBLISHED"
      },
      "menus": [
        {
          "id": "60000001-0000-4000-8000-000000000001",
          "code": "STOCK",
          "label": "Stock Management",
          "sortOrder": 1,
          "subMenus": [
            {
              "id": "70000001-0000-4000-8000-000000000001",
              "code": "STOCK_OPS",
              "label": "Operations",
              "sortOrder": 1,
              "options": [
                {
                  "id": "80000001-0000-4000-8000-000000000003",
                  "code": "STOCK_DELETE",
                  "label": "Delete Stock Record",
                  "actionCode": "DELETE",
                  "effect": "Deny",
                  "source": "Override"
                }
              ]
            }
          ]
        }
      ]
    }
  ],
  "domainPermissions": [
    {
      "resource": {
        "id": "90000001-0000-4000-8000-000000000001",
        "type": "Aggregate",
        "code": "PURCHASE_ORDER",
        "name": "Purchase Order",
        "moduleId": "50000001-0000-4000-8000-000000000001"
      },
      "actions": [
        {
          "actionId": "a0000001-0000-4000-8000-000000000004",
          "actionCode": "DELETE",
          "actionName": "Delete",
          "effect": "Deny",
          "source": "Override"
        }
      ]
    }
  ],
  "featureFlags": [],
  "effectiveConfig": {
    "sessionTimeoutMinutes": 60,
    "maxLoginAttempts": 5,
    "minPasswordLength": 12,
    "mfaRequiredForAdmin": true,
    "accessTokenDurationMs": 3600000,
    "authUseExternalIdp": false
  },
  "scopes": [],
  "generatedAt": "2026-05-31T14:30:00Z",
  "validUntil": "2026-05-31T15:30:00Z"
}
