{
  "schemaVersion": "1.0.0",
  "context": {
    "user": {
      "id": "7a1d4e22-0001-4f00-9a00-100000000001",
      "email": "ana.flores@logistics-corp.example",
      "username": "ana.flores",
      "displayName": "Ana Flores",
      "status": "ACTIVE"
    },
    "tenant": {
      "id": "11111111-1111-4111-8111-111111111111",
      "code": "LOGISTICS_CORE",
      "name": "Logistics Corp",
      "status": "ACTIVE"
    },
    "systemSuite": {
      "id": "22222222-2222-4222-8222-222222222222",
      "code": "WMS_SUITE",
      "name": "Warehouse Management Suite",
      "status": "PUBLISHED"
    },
    "role": {
      "id": "33333333-3333-4333-8333-333333333333",
      "code": "WAREHOUSE_SUPERVISOR",
      "name": "Warehouse Supervisor",
      "hierarchyLevel": 3,
      "parentRoleId": "33333333-3333-4333-8333-333333333330"
    },
    "profile": {
      "id": "44444444-4444-4444-8444-444444444444",
      "scope": "OrgWide",
      "isActive": true
    },
    "branch": null
  },
  "authentication": {
    "method": "Local",
    "provider": null,
    "mfaRequired": false,
    "issuedAt": "2026-05-31T14:30:00Z",
    "sessionExpiresAt": "2026-05-31T15:30:00Z"
  },
  "actions": [
    { "id": "a0000001-0000-4000-8000-000000000001", "code": "VIEW", "name": "View" },
    { "id": "a0000001-0000-4000-8000-000000000002", "code": "CREATE", "name": "Create" },
    { "id": "a0000001-0000-4000-8000-000000000003", "code": "UPDATE", "name": "Update" },
    { "id": "a0000001-0000-4000-8000-000000000004", "code": "DELETE", "name": "Delete" },
    { "id": "a0000001-0000-4000-8000-000000000005", "code": "APPROVE", "name": "Approve" }
  ],
  "menuAccess": [
    {
      "module": {
        "id": "50000001-0000-4000-8000-000000000001",
        "code": "INVENTORY",
        "name": "Inventory",
        "sortOrder": 1,
        "status": "PUBLISHED"
      },
      "menus": [
        {
          "id": "60000001-0000-4000-8000-000000000001",
          "code": "STOCK",
          "label": "Stock Management",
          "sortOrder": 1,
          "subMenus": [
            {
              "id": "70000001-0000-4000-8000-000000000001",
              "code": "STOCK_OPS",
              "label": "Operations",
              "sortOrder": 1,
              "options": [
                {
                  "id": "80000001-0000-4000-8000-000000000001",
                  "code": "STOCK_VIEW",
                  "label": "View Stock",
                  "actionCode": "VIEW",
                  "effect": "Allow",
                  "source": "Template"
                },
                {
                  "id": "80000001-0000-4000-8000-000000000002",
                  "code": "STOCK_ADJUST",
                  "label": "Adjust Stock",
                  "actionCode": "UPDATE",
                  "effect": "NotGranted",
                  "source": "Template"
                }
              ]
            }
          ]
        }
      ]
    }
  ],
  "domainPermissions": [
    {
      "resource": {
        "id": "90000001-0000-4000-8000-000000000001",
        "type": "Aggregate",
        "code": "PURCHASE_ORDER",
        "name": "Purchase Order",
        "moduleId": "50000001-0000-4000-8000-000000000001"
      },
      "actions": [
        {
          "actionId": "a0000001-0000-4000-8000-000000000001",
          "actionCode": "VIEW",
          "actionName": "View",
          "effect": "Allow",
          "source": "Template"
        },
        {
          "actionId": "a0000001-0000-4000-8000-000000000005",
          "actionCode": "APPROVE",
          "actionName": "Approve",
          "effect": "NotGranted",
          "source": "Template"
        }
      ]
    }
  ],
  "featureFlags": [
    {
      "flagCode": "WMS_BULK_EXPORT",
      "systemSuiteId": "22222222-2222-4222-8222-222222222222",
      "isEnabled": false,
      "matchedCriteriaType": null
    }
  ],
  "effectiveConfig": {
    "sessionTimeoutMinutes": 60,
    "maxLoginAttempts": 5,
    "minPasswordLength": 12,
    "mfaRequiredForAdmin": true,
    "accessTokenDurationMs": 3600000,
    "authUseExternalIdp": false
  },
  "scopes": [
    "STOCK_VIEW.VIEW",
    "PURCHASE_ORDER.VIEW"
  ],
  "generatedAt": "2026-05-31T14:30:00Z",
  "validUntil": "2026-05-31T15:30:00Z"
}
